<?xml version="1.0" encoding="UTF-8"?>
<!DOCTYPE visitas SYSTEM "lista_pisos.dtd">

<pisos ult_id="9">
    <piso id = "1">
        <direccion>noseque kalea</direccion>
        <precio>300</precio>
        <habitaciones> 2 </habitaciones>
        <fianza> 600 </fianza>
        <descripcion> este piso claramente no existse, quiero decir, tu has visto el precio? </descripcion>
        <tel>6666666</tel>
        <nombre>Aitor tilla</nombre>
        <mail>satan@atana.xsa</mail>
        <fotos ult_id = "0" tiene = "si">
            <foto id = "0">url1</foto>
        </fotos>
        <caracteristicas 
            lavavajillas="0"
            wifi = "1"
            terraza = "1"
            lavadora = "1"        
            >
        </caracteristicas>
    </piso>
</pisos>